{
  "schemaVersion": "boundary-first.binding.cyoa.v1",
  "bindingProtocol": {
    "id": "bfl-cyoa-adaptive-onramps",
    "version": "0.2.0",
    "title": "Choose Your Own On-Ramp",
    "status": "draft",
    "claimCeiling": "pedagogical-on-ramp",
    "provenance": {
      "createdFrom": [
        "backlog/4_boundary_first_spatial_ux_design_archive_2026-08-01/plans/requirements_specification.md#FR-006",
        "backlog/4_boundary_first_spatial_ux_design_archive_2026-08-01/plans/binding_protocol_and_schema_plan.md",
        "backlog/4_boundary_first_spatial_ux_design_archive_2026-08-01/source_context/on_ramps_to_distinction_theory_v_0_2_revised.md"
      ],
      "implementedAt": "/problem"
    },
    "compatibility": {
      "renderer": "next-app-router/cyoa-guided-path-v1",
      "canonicalNodeSource": "src/content/nodes.json"
    }
  },
  "source": {
    "schemaFamily": "custom",
    "schemaReference": "src/content/schemas/cyoa-binding.schema.json",
    "adapters": ["canonical-domain-href"]
  },
  "semantics": {
    "conceptRegistry": [
      {
        "id": "boundary",
        "label": "Boundary",
        "definition": "A declared distinction that conditions what may cross, transform, or remain separate.",
        "canonicalNodeIds": ["boundary-theory"]
      },
      {
        "id": "interface",
        "label": "Interface",
        "definition": "A typed crossing whose permitted inputs, meanings, actions, and failures are declared.",
        "canonicalNodeIds": ["formal-grammars", "representational-mechanics"]
      },
      {
        "id": "admissibility",
        "label": "Admissibility",
        "definition": "The conditions under which an operation, transition, or comparison is permitted.",
        "canonicalNodeIds": ["formal-grammars"]
      },
      {
        "id": "defect",
        "label": "Defect",
        "definition": "A typed failure of preservation, correspondence, closure, or lawful transition.",
        "canonicalNodeIds": ["representational-mechanics", "boundary-theory"]
      },
      {
        "id": "closure",
        "label": "Closure",
        "definition": "Completion sufficient for a declared purpose under declared conditions and reopening rules.",
        "canonicalNodeIds": ["boundary-theory", "bfe"]
      },
      {
        "id": "invariant",
        "label": "Invariant",
        "definition": "A structure or relation required to remain preserved under admitted transformation.",
        "canonicalNodeIds": ["boundary-theory", "representational-mechanics"]
      },
      {
        "id": "scope",
        "label": "Scope",
        "definition": "The declared operating domain within which a claim, test, or closure condition applies.",
        "canonicalNodeIds": ["bfe"]
      },
      {
        "id": "reopening",
        "label": "Reopening",
        "definition": "A declared condition that lawfully returns closed work to active inquiry or repair.",
        "canonicalNodeIds": ["boundary-theory", "corpus"]
      },
      {
        "id": "representation",
        "label": "Representation",
        "definition": "A purpose-typed presentation of selected structure from a richer source or carrier.",
        "canonicalNodeIds": ["representational-mechanics"]
      },
      {
        "id": "projection",
        "label": "Projection",
        "definition": "A mapping that preserves selected structure while intentionally or consequentially discarding other structure.",
        "canonicalNodeIds": ["representational-mechanics"]
      },
      {
        "id": "transport",
        "label": "Transport",
        "definition": "Movement of structure, meaning, or state between declared carriers or contextures.",
        "canonicalNodeIds": ["representational-mechanics", "formal-grammars"]
      },
      {
        "id": "ownership",
        "label": "Ownership",
        "definition": "Accountability for maintaining, testing, authorizing, or repairing a bounded object or transition.",
        "canonicalNodeIds": ["governance-institutions", "bfe"]
      },
      {
        "id": "repair",
        "label": "Repair",
        "definition": "A governed change that restores a failed invariant, correspondence, or reachable path.",
        "canonicalNodeIds": ["bfe", "corpus"]
      },
      {
        "id": "gauge",
        "label": "Gauge",
        "definition": "A declared observational or representational frame that conditions what can be measured or compared.",
        "canonicalNodeIds": ["physics", "representational-mechanics"]
      },
      {
        "id": "measurement",
        "label": "Measurement",
        "definition": "Disciplined representation through a declared instrument, gauge, unit, and precision.",
        "canonicalNodeIds": ["representational-mechanics", "physics"]
      },
      {
        "id": "trace",
        "label": "Trace",
        "definition": "A preserved record of an operation, observation, transition, or failure.",
        "canonicalNodeIds": ["corpus"]
      },
      {
        "id": "correspondence",
        "label": "Correspondence",
        "definition": "A declared relation used to compare expected, represented, and observed states.",
        "canonicalNodeIds": ["representational-mechanics"]
      },
      {
        "id": "agency",
        "label": "Agency",
        "definition": "The consequential actions an actor can actually reach within declared constraints.",
        "canonicalNodeIds": ["constructive-humanist-agentics"]
      },
      {
        "id": "standing",
        "label": "Standing",
        "definition": "Recognized authority to enter a process, raise a claim, or seek review and remedy.",
        "canonicalNodeIds": ["governance-institutions"]
      },
      {
        "id": "contestability",
        "label": "Contestability",
        "definition": "A reachable and consequential path for challenging a decision, claim, or status.",
        "canonicalNodeIds": ["governance-institutions"]
      },
      {
        "id": "authority",
        "label": "Authority",
        "definition": "Permission to take bounded actions for a declared purpose under reviewable conditions.",
        "canonicalNodeIds": ["governance-institutions", "constructive-humanist-agentics"]
      },
      {
        "id": "provenance",
        "label": "Provenance",
        "definition": "Durable evidence of origin, transformation, stewardship, and promotion history.",
        "canonicalNodeIds": ["corpus"]
      },
      {
        "id": "transformation",
        "label": "Transformation",
        "definition": "A typed operation that changes a carrier or representation under declared rules.",
        "canonicalNodeIds": ["boundary-theory", "formal-grammars"]
      },
      {
        "id": "identity",
        "label": "Identity",
        "definition": "The structure sufficient to recognize continuity across admitted change.",
        "canonicalNodeIds": ["boundary-theory", "identity"]
      },
      {
        "id": "scale",
        "label": "Scale",
        "definition": "A regime of extent or relation that conditions which structure remains accessible.",
        "canonicalNodeIds": ["physics"]
      },
      {
        "id": "resolution",
        "label": "Resolution",
        "definition": "The discriminating capacity of a representation or observational regime.",
        "canonicalNodeIds": ["physics", "representational-mechanics"]
      },
      {
        "id": "observability",
        "label": "Observability",
        "definition": "Whether a feature can be exposed under declared conditions, instruments, and resolution.",
        "canonicalNodeIds": ["physics", "representational-mechanics"]
      },
      {
        "id": "purpose",
        "label": "Purpose",
        "definition": "The declared end that bounds relevance, sufficiency, and closure.",
        "canonicalNodeIds": ["identity", "bfe"]
      },
      {
        "id": "on-ramp",
        "label": "On-ramp",
        "definition": "A familiar example that orients a learner toward formal structure without claiming to establish it.",
        "canonicalNodeIds": ["on-ramps"]
      },
      {
        "id": "typing",
        "label": "Typing",
        "definition": "Explicit declaration of the kind, domain, and permitted operations of an object or relation.",
        "canonicalNodeIds": ["formal-grammars"]
      },
      {
        "id": "claim-ceiling",
        "label": "Claim ceiling",
        "definition": "The strongest class of conclusion an artifact is permitted to support.",
        "canonicalNodeIds": ["corpus"]
      },
      {
        "id": "formalization",
        "label": "Formalization",
        "definition": "Translation from an intuitive handle into declared objects, relations, operations, and constraints.",
        "canonicalNodeIds": ["formal-grammars", "mathematics"]
      }
    ],
    "onramps": [
      {
        "id": "onramp:software",
        "slug": "software",
        "number": "01",
        "label": "Systems & software",
        "prompt": "Two correct parts failed together.",
        "description": "Start where an interface turns local success into system failure.",
        "canonicalNodeIds": ["software-engineering-practice", "bfe", "formal-grammars"],
        "choices": [
          {
            "id": "choice:software-interface",
            "slug": "interface",
            "title": "The interface kept its syntax and broke its promise.",
            "scene": "Two services exchanged valid messages. The workflow still failed because each side meant something different by ‘complete.’",
            "conceptLabel": "The API as boundary contract",
            "conceptIds": ["boundary", "interface", "admissibility", "defect"],
            "canonicalNodeIds": ["software-engineering-practice", "formal-grammars", "representational-mechanics"],
            "lesson": "An interface is more than a connection point. It declares what may cross, what must remain true, and what each side may rely on.",